subreddit,post_id,upvote_score,submission_content,author,created_utc
AmazonSeller,1g8kucr,9,"Crazy deductions from sales-: I’m a new seller and only have one product that I created..
Had a bunch of sales earlier this month..
Then after all of Amazon’s taxes and coupon redemption fees etc. and Advertizing ended up with Zero .
Seems like their way of describing stuff is tricky.
For example I selected “coupon does not stack” but they still double charged me discounts such as prime discount in addition to coupon discount ..
Then I had some international listing.
They didn’t tell me they were going to charge me a subscription fee but then it shows up.
In addition to all the other fees.
Seems like their system is so confusing purposefully…
It’s like a shell game",WaschiiTravelLaundry,"2024-10-21, 04:31, Monday"
AmazonSeller,1g8kucr,1,"**To all participants** 

CAUTION: ecomm forums are constantly targeted by spammers and scammers. Common ruses include the helpful-guru-scammer, use of alt accounts to decieve, and the ""my friend can help"" switcharoo. Do not respond to DM / PM / message requests even if it seems helpful or free. Do not click links people offer for their own services, apps, videos, etc. especially links to documents, downloads, and unclear urls. Report scam attempt private messages.

Most questions are addressed by Amazon's [**Seller Policies and Code of Conduct**](https://sellercentral.amazon.com/help/hub/reference/external/G1801), their [**FAQ**](https://sell.amazon.com/learn/faq), and their [**Amazon Seller University**](https://www.youtube.com/channel/UCUG5BEHfTZXPLwSHl4NSy3Q) video course

---

**The sub promotion rules are strict and enforced**  

(especially VAs, consultants, app devs, freight forwarders, and others targeting sub participants) A violation will result in a ban. **DO NOT attempt to drive traffic to something of yours, otherwise promote, hype yourself, or lead generate anywhere in this sub outside [the Community Promotion Post](https://www.reddit.com/r/amazonseller/about/sticky?num=2).** Additionally, ***DO NOT ask others here to PM / DM / offline contact you***

---

**Correcting common myths and misinformation**

* **Arbitrage / OA / RA** - It is neither all allowed nor all disallowed on Amazon. Their policies determine what circumstances are allowable and how it has to be handled by the seller.

* **""First sale doctrine""** - This is often misunderstood and misapplied. It is not a blanket exception from Amazon policies or a license to force OA allowance in any manner desired. Arbitrage is allowable but must comply with Amazon policies. They do not want retail purchases resold on their platform (mis)represented as 'new' or their customers having issues like warranties not being honored due to original purchaser confusion. For some brands and categories, an invoice is *required* to qualify and a retail receipt does not comply.

* **Receipts and invoices** - A retail receipt is NOT an invoice. [**See this article to learn the difference**](https://quickbooks.intuit.com/r/invoicing/invoice-vs-receipt/). In cases where an invoice is required by Amazon, the invoice MUST meet Amazon's specific requirements. ""Someone I know successfully used a receipt and..."", well congratulations to them. That does not change Amazon's policies, that invoice policy enforcement is increasing, and that scenarios requiring a compliant invoice are growing.

* **Target receipts** - Some scenarios allow receipts and a Target receipt will comply. For those categories and ungating cases where an *invoice* is required, Target retail receipts DO NOT comply with Amazon's invoice requirements. Someone you know getting away with submitting a receipt once (or more) does not mean it's the same category or scenario as someone else, nor does it change Amazon's policies or their growing enforcement of them.

* **Paid courses and buyer groups** - In most cases, they're a scam. Avoid. Amazon's Seller University is the best place to start.

### UPDATE: ACTIVE SCAM CAUTION 

***Scammers are targeting participants of this subreddit with private messages. DO NOT respond to PMs or invites to other forums. Be wary of individuals, entities, and forums which provide scams, sucker seeking, and blatant misinformation***

---


*I am a bot, and this action was performed automatically. Please [contact the moderators of this subreddit](/message/compose/?to=/r/AmazonSeller) if you have any questions or concerns.*",AutoModerator,"2024-10-21, 04:31, Monday"
AmazonSeller,1g8kucr,3,"Welcome to selling on Amazon.
Land mines everywhere.",RonCheeWan,"2024-10-21, 11:02, Monday"
AmazonSeller,1g8kucr,3,Probably best to pause your account and do a full audit on costs.,Wu-Kang,"2024-10-21, 17:55, Monday"
AmazonSeller,1g8kucr,1,"They are the biggest fish in the game. You play with their rules. If you don’t like learning rules probably you will be better off doing shopify since it’s your rule at your site, but still ads will be a huge expense for you unless you have a million followers in your TikTok or other social media",Dependent_Desk_1944,"2024-10-22, 06:45, Tuesday"
AmazonSeller,1ga4enq,6,"Can I sell at amazon even If I am in Jordan (MENA): Hi all, 
Am asking whether I can sell products on Amazon even there are no stores in Jordan how would that reflect the fees.

Also can I choose which market place that can l sell for?",Sorry_Ad1805,"2024-10-23, 03:05, Wednesday"
AmazonSeller,1ga4enq,1,"**To all participants** 

CAUTION: ecomm forums are constantly targeted by spammers and scammers. Common ruses include the helpful-guru-scammer, use of alt accounts to decieve, and the ""my friend can help"" switcharoo. Do not respond to DM / PM / message requests even if it seems helpful or free. Do not click links people offer for their own services, apps, videos, etc. especially links to documents, downloads, and unclear urls. Report scam attempt private messages.

Most questions are addressed by Amazon's [**Seller Policies and Code of Conduct**](https://sellercentral.amazon.com/help/hub/reference/external/G1801), their [**FAQ**](https://sell.amazon.com/learn/faq), and their [**Amazon Seller University**](https://www.youtube.com/channel/UCUG5BEHfTZXPLwSHl4NSy3Q) video course

---

**The sub promotion rules are strict and enforced**  

(especially VAs, consultants, app devs, freight forwarders, and others targeting sub participants) A violation will result in a ban. **DO NOT attempt to drive traffic to something of yours, otherwise promote, hype yourself, or lead generate anywhere in this sub outside [the Community Promotion Post](https://www.reddit.com/r/amazonseller/about/sticky?num=2).** Additionally, ***DO NOT ask others here to PM / DM / offline contact you***

---

**Correcting common myths and misinformation**

* **Arbitrage / OA / RA** - It is neither all allowed nor all disallowed on Amazon. Their policies determine what circumstances are allowable and how it has to be handled by the seller.

* **""First sale doctrine""** - This is often misunderstood and misapplied. It is not a blanket exception from Amazon policies or a license to force OA allowance in any manner desired. Arbitrage is allowable but must comply with Amazon policies. They do not want retail purchases resold on their platform (mis)represented as 'new' or their customers having issues like warranties not being honored due to original purchaser confusion. For some brands and categories, an invoice is *required* to qualify and a retail receipt does not comply.

* **Receipts and invoices** - A retail receipt is NOT an invoice. [**See this article to learn the difference**](https://quickbooks.intuit.com/r/invoicing/invoice-vs-receipt/). In cases where an invoice is required by Amazon, the invoice MUST meet Amazon's specific requirements. ""Someone I know successfully used a receipt and..."", well congratulations to them. That does not change Amazon's policies, that invoice policy enforcement is increasing, and that scenarios requiring a compliant invoice are growing.

* **Target receipts** - Some scenarios allow receipts and a Target receipt will comply. For those categories and ungating cases where an *invoice* is required, Target retail receipts DO NOT comply with Amazon's invoice requirements. Someone you know getting away with submitting a receipt once (or more) does not mean it's the same category or scenario as someone else, nor does it change Amazon's policies or their growing enforcement of them.

* **Paid courses and buyer groups** - In most cases, they're a scam. Avoid. Amazon's Seller University is the best place to start.

### UPDATE: ACTIVE SCAM CAUTION 

***Scammers are targeting participants of this subreddit with private messages. DO NOT respond to PMs or invites to other forums. Be wary of individuals, entities, and forums which provide scams, sucker seeking, and blatant misinformation***

---


*I am a bot, and this action was performed automatically. Please [contact the moderators of this subreddit](/message/compose/?to=/r/AmazonSeller) if you have any questions or concerns.*",AutoModerator,"2024-10-23, 03:05, Wednesday"
AmazonSeller,1ga4enq,1,"Yess you can sell , you can sell on US market UK or Australia marketplace , once opening seller central account and filling all the information and documents as per asked . Registration may take little while ( as they are more aware of scams : due to which they may ask for different identities documents) but once done as said , you just need to find the products to sell, source it for less and sell it for more holding profit. Try the market with different products overtime .",Dev_explores,"2024-10-23, 04:03, Wednesday"
AmazonSeller,1ga4enq,1,Do u sell in US market ?,tarun479,"2024-10-23, 04:12, Wednesday"
AmazonSeller,1ga4enq,1,"Even though there are no stores, you can sign up as an Amazon seller and sell in the approved marketplaces by completing your identity verification. If you sign up as a professional seller, they will charge you $39.99 per month which you can convert to your local currency to analyze how much it is. For the products that you sell there, their fees will be the same in the US, Euro, and Pound based on the marketplace you sell in.",Unhappy_Patient_8870,"2024-10-23, 07:57, Wednesday"
AmazonSeller,1ga4enq,1,"Lots of sellers from China do that. They send it directly to Amazon warehouse in each particular market.
So everyone can do it.
Probably they would expect you to play by the book with taxation",Boogooooooo,"2024-10-23, 16:08, Wednesday"
AmazonSeller,1g77axt,6,"Suspicious activity: About a week ago I recieved an email notification from Amazon that I had a copyright infringement report filed against my product. 

Yesterday I get an email from a lawyer with a list of about 100 other people on the list stating that we have 21 days to reply and that a lawsuit was filed with like 5 different attachments of legalese papers.

Today I randomly get a message on Amazon stating that we noticed you were on the list of defendants of case so and so and have solutions for you.

Is this all one big scam or is this legit? 

Thanks in advance!",S_Teeny,"2024-10-19, 07:59, Saturday"
AmazonSeller,1g77axt,1,"**To all participants** 

CAUTION: ecomm forums are constantly targeted by spammers and scammers. Common ruses include the helpful-guru-scammer, use of alt accounts to decieve, and the ""my friend can help"" switcharoo. Do not respond to DM / PM / message requests even if it seems helpful or free. Do not click links people offer for their own services, apps, videos, etc. especially links to documents, downloads, and unclear urls. Report scam attempt private messages.

Most questions are addressed by Amazon's [**Seller Policies and Code of Conduct**](https://sellercentral.amazon.com/help/hub/reference/external/G1801), their [**FAQ**](https://sell.amazon.com/learn/faq), and their [**Amazon Seller University**](https://www.youtube.com/channel/UCUG5BEHfTZXPLwSHl4NSy3Q) video course

---

**The sub promotion rules are strict and enforced**  

(especially VAs, consultants, app devs, freight forwarders, and others targeting sub participants) A violation will result in a ban. **DO NOT attempt to drive traffic to something of yours, otherwise promote, hype yourself, or lead generate anywhere in this sub outside [the Community Promotion Post](https://www.reddit.com/r/amazonseller/about/sticky?num=2).** Additionally, ***DO NOT ask others here to PM / DM / offline contact you***

---

**Correcting common myths and misinformation**

* **Arbitrage / OA / RA** - It is neither all allowed nor all disallowed on Amazon. Their policies determine what circumstances are allowable and how it has to be handled by the seller.

* **""First sale doctrine""** - This is often misunderstood and misapplied. It is not a blanket exception from Amazon policies or a license to force OA allowance in any manner desired. Arbitrage is allowable but must comply with Amazon policies. They do not want retail purchases resold on their platform (mis)represented as 'new' or their customers having issues like warranties not being honored due to original purchaser confusion. For some brands and categories, an invoice is *required* to qualify and a retail receipt does not comply.

* **Receipts and invoices** - A retail receipt is NOT an invoice. [**See this article to learn the difference**](https://quickbooks.intuit.com/r/invoicing/invoice-vs-receipt/). In cases where an invoice is required by Amazon, the invoice MUST meet Amazon's specific requirements. ""Someone I know successfully used a receipt and..."", well congratulations to them. That does not change Amazon's policies, that invoice policy enforcement is increasing, and that scenarios requiring a compliant invoice are growing.

* **Target receipts** - Some scenarios allow receipts and a Target receipt will comply. For those categories and ungating cases where an *invoice* is required, Target retail receipts DO NOT comply with Amazon's invoice requirements. Someone you know getting away with submitting a receipt once (or more) does not mean it's the same category or scenario as someone else, nor does it change Amazon's policies or their growing enforcement of them.

* **Paid courses and buyer groups** - In most cases, they're a scam. Avoid. Amazon's Seller University is the best place to start.

### UPDATE: ACTIVE SCAM CAUTION 

***Scammers are targeting participants of this subreddit with private messages. DO NOT respond to PMs or invites to other forums. Be wary of individuals, entities, and forums which provide scams, sucker seeking, and blatant misinformation***

---


*I am a bot, and this action was performed automatically. Please [contact the moderators of this subreddit](/message/compose/?to=/r/AmazonSeller) if you have any questions or concerns.*",AutoModerator,"2024-10-19, 07:59, Saturday"
AmazonSeller,1g77axt,6,100% smells like a scam.,TrickyCod208,"2024-10-19, 08:30, Saturday"
AmazonSeller,1g77axt,3,Message from amazon or in amazon? Just ignore (and report) if it is Not from Amazon.,Dish_Melodic,"2024-10-19, 09:31, Saturday"
AmazonSeller,1g77axt,1,The first was just an email to my direct email account and the next day was just a product enquiry message saying that we understood you've been included in the lawsuit.,S_Teeny,"2024-10-19, 16:58, Saturday"
AmazonSeller,1g77axt,1,Scammmmmmm,No-Radish-129,"2024-10-20, 00:39, Sunday"
AmazonSeller,1g77axt,2,Scam,jimjoekelly33,"2024-10-19, 09:07, Saturday"
AmazonSeller,1g77axt,2,"Be sure those emails are really from Amazon. It is possible to spoof the sender in an email header. If you have any real violation/issue with Amazon, you should be able to find it on your Account Health page, or thereabouts.

NOTE There are a$$holes who are some ""flavor"" of legit that threaten sellers in mass like this over IP that they actually do have rights to, but mainly use those rights to scare people into paying them a settlement, rather than to use/sell the IP themselves. Say who the IP owner and lawyer are supposed to be, or just search for them yourself, and you'll soon find out if they are the people I am referring to (don't remember the name myself).",NoXidCat,"2024-10-19, 16:08, Saturday"
AmazonSeller,1g77axt,2,I appreciate that. I'll contact amazon and see if the settlements are usually dome directly or what the situation is.,S_Teeny,"2024-10-19, 16:59, Saturday"
AmazonSeller,1g93lzi,4,"How do you effectively manage MFN returns on Amazon?: Many of the returns I get feel completely frivolous, with buyers giving excuses like “ordered by mistake” or “wrong size.” The frustrating part is that less than 50% of these returns are ever actually shipped back to me. When I contact Amazon support, I get conflicting advice on how to handle return authorization requests. I have just ignored them completely.

Is it even worth messaging the customer to try and resolve these issues directly? Honestly, the return portal seems pretty useless. The only productive thing I’ve found is managing A-to-Z claims when buyers say the order wasn’t delivered, even though I have proof it was. I get refunded on those.

Does anyone have a practical system for managing returns efficiently? Also, when a buyer generates a return label (at my expense) but never ships the item back, does Amazon refund me for the cost of the unused label? Any insights would be appreciated.",honeybee8388,"2024-10-21, 19:08, Monday"
AmazonSeller,1g93lzi,1,"**To all participants** 

CAUTION: ecomm forums are constantly targeted by spammers and scammers. Common ruses include the helpful-guru-scammer, use of alt accounts to decieve, and the ""my friend can help"" switcharoo. Do not respond to DM / PM / message requests even if it seems helpful or free. Do not click links people offer for their own services, apps, videos, etc. especially links to documents, downloads, and unclear urls. Report scam attempt private messages.

Most questions are addressed by Amazon's [**Seller Policies and Code of Conduct**](https://sellercentral.amazon.com/help/hub/reference/external/G1801), their [**FAQ**](https://sell.amazon.com/learn/faq), and their [**Amazon Seller University**](https://www.youtube.com/channel/UCUG5BEHfTZXPLwSHl4NSy3Q) video course

---

**The sub promotion rules are strict and enforced**  

(especially VAs, consultants, app devs, freight forwarders, and others targeting sub participants) A violation will result in a ban. **DO NOT attempt to drive traffic to something of yours, otherwise promote, hype yourself, or lead generate anywhere in this sub outside [the Community Promotion Post](https://www.reddit.com/r/amazonseller/about/sticky?num=2).** Additionally, ***DO NOT ask others here to PM / DM / offline contact you***

---

**Correcting common myths and misinformation**

* **Arbitrage / OA / RA** - It is neither all allowed nor all disallowed on Amazon. Their policies determine what circumstances are allowable and how it has to be handled by the seller.

* **""First sale doctrine""** - This is often misunderstood and misapplied. It is not a blanket exception from Amazon policies or a license to force OA allowance in any manner desired. Arbitrage is allowable but must comply with Amazon policies. They do not want retail purchases resold on their platform (mis)represented as 'new' or their customers having issues like warranties not being honored due to original purchaser confusion. For some brands and categories, an invoice is *required* to qualify and a retail receipt does not comply.

* **Receipts and invoices** - A retail receipt is NOT an invoice. [**See this article to learn the difference**](https://quickbooks.intuit.com/r/invoicing/invoice-vs-receipt/). In cases where an invoice is required by Amazon, the invoice MUST meet Amazon's specific requirements. ""Someone I know successfully used a receipt and..."", well congratulations to them. That does not change Amazon's policies, that invoice policy enforcement is increasing, and that scenarios requiring a compliant invoice are growing.

* **Target receipts** - Some scenarios allow receipts and a Target receipt will comply. For those categories and ungating cases where an *invoice* is required, Target retail receipts DO NOT comply with Amazon's invoice requirements. Someone you know getting away with submitting a receipt once (or more) does not mean it's the same category or scenario as someone else, nor does it change Amazon's policies or their growing enforcement of them.

* **Paid courses and buyer groups** - In most cases, they're a scam. Avoid. Amazon's Seller University is the best place to start.

### UPDATE: ACTIVE SCAM CAUTION 

***Scammers are targeting participants of this subreddit with private messages. DO NOT respond to PMs or invites to other forums. Be wary of individuals, entities, and forums which provide scams, sucker seeking, and blatant misinformation***

---


*I am a bot, and this action was performed automatically. Please [contact the moderators of this subreddit](/message/compose/?to=/r/AmazonSeller) if you have any questions or concerns.*",AutoModerator,"2024-10-21, 19:08, Monday"
AmazonSeller,1g93lzi,3,Turn off CSBA and your life will improve considerably,Xing_the_Rubicon,"2024-10-22, 03:16, Tuesday"
AmazonSeller,1g93lzi,2,"**Amazon policy / info on Returns and Refunds** -  https://sellercentral.amazon.com/help/hub/reference/external/G69126 (additional links at the bottom of the page)

*I am a bot, and this action was performed automatically. Please [contact the moderators of this subreddit](/message/compose/?to=/r/AmazonSeller) if you have any questions or concerns.*",AutoModerator,"2024-10-21, 19:08, Monday"
AmazonSeller,1g93lzi,1,"Track 'em and challenge 'em.  Keep a spreadsheet, if nothing else, as each return is documented in an email by order number.  There is at least a ""return administration fee"", so it is not unreasonable to open a case and say ""Order # xyz was slated to be returned, but has not been, despite the lapse of 90 days, so please reimburse all fees, as this was never returned.""",packetfire,"2024-10-21, 22:26, Monday"
AmazonSeller,1g93lzi,1,"Many of the same services that monitor your account for inventory discrepancies will also monitor your account for non-returned ""returns"" and open support tickets for reimbursement.",douglasjunk,"2024-10-22, 13:46, Tuesday"
AmazonSeller,1g7wvwc,3,"Do new sellers automatically get denied the Buy Box?: Hello. I’m new to Amazon Seller and sell through Printify. I have 51 listings, and none of them have the Buy Box. I understand that there are certain requirements to qualify for it, and I meet some of the most important ones thanks to the professionalism of Printify’s suppliers. However, I’m curious if being a new seller means I’m automatically excluded from getting the Buy Box, regardless of my other qualifications.

Thank you.",arturovivo,"2024-10-20, 07:48, Sunday"
