subreddit,post_id,upvote_score,submission_content,author,created_utc
FulfillmentByAmazon,1g5uf7v,1,"I'm on the same boat too. I'm planning to launch my DTC website by the end of the year via wordpress/woocommerce. I've been relying on Amazon FBM since 2016. However, the constant pressure of maintaining performance metrics has been causing me stress, and I feel it's time to stop depending solely on Amazon. 

I'm curious if anyone else would be interested in forming a casual low key Discord group where we could discuss strategies, share experiences, and support each other in this journey.",cptnkook,"2024-10-18, 02:18, Friday"
FulfillmentByAmazon,1g5fanq,6,"I submitted a Goodwill receipt as an invoice on Amazon and it was accepted instantly, should I be worried?: 
I am a brand new used book reseller on Amazon, flipping books through Amazon FBA. I’ve gone to quite a few goodwills at this point gathering a little over 100 books I was planning on listing. After trying to list just around 30 books I came across a very frustrating issue. The vast majority of the books I was trying to list were restricted and required invoices despite them being used. In my frustration, I decided to submit a receipt from Goodwill as an invoice to get ungated for multiple different publishers. To my astonishment, all of my applications were accepted which left me a little worried. After some research, I am now realizing that this is a pretty big mistake and although all of my applications were approved I’m worried something may happen to my account in the future. I have not sent in any of the books under these publishers yet but I have them listed. Should I be worried and is there anything I can do right now to prevent future consequences?",CodoGama,"2024-10-16, 21:16, Wednesday"
FulfillmentByAmazon,1g5fanq,1,"#####[Join Our Discord Server!](https://discord.gg/VcRZTsS)

We created a Discord server for our community and would like to invite all of you to join! You'll be able to discuss FBA with users around the world and discuss events in real time!

There are separate channels for many FBA topics which you can opt in and out of, including;  
PPC, Listing Optimization, Logistics, Jobs, Advanced FBA, Top Secret/Insider Info, Off-Topic


*I am a bot, and this action was performed automatically. Please [contact the moderators of this subreddit](/message/compose/?to=/r/FulfillmentByAmazon) if you have any questions or concerns.*",AutoModerator,"2024-10-16, 21:16, Wednesday"
FulfillmentByAmazon,1g5fanq,13,Sounds like you got lucky and the minimum wage worker accidentally hit approve instead of deny. Get while the gittens good ,mtgguy999,"2024-10-16, 21:47, Wednesday"
FulfillmentByAmazon,1g5fanq,3,"Book reselling on Amazon is fairly risky at this point, so you aren't going to have much certainty.  Also books bought at Goodwill would only be used, not new which will reduce your risk a bit.",resoluter08,"2024-10-16, 22:21, Wednesday"
FulfillmentByAmazon,1g5fanq,3,Is this new this year? Years ago (3/4) this is how a lot of people got started on AMZ. Recently I see an influx of people having issues with books all of the sudden.,Guilty-Celebration25,"2024-10-17, 00:43, Thursday"
FulfillmentByAmazon,1g5fanq,1,Either Amazon thinks the books are pesticide or these are textbooks which I think are coming under some stricter regulations on Amazon.,scithe,"2024-10-18, 01:56, Friday"
FulfillmentByAmazon,1g5fanq,3,If Amazon accepted your invoice. You’re good to go. They may re-ask in future. But for now you’re good. Ignore the people who probably do 1 sale/week and are tryna scare ya.,jkg2001,"2024-10-17, 01:54, Thursday"
FulfillmentByAmazon,1g5fanq,2,"Are these people serious?? Why would they destroy your inventory just from nothing? Makes no sense to me, those are not clear answers, of course you can sell them, once you have unlocked from selling them with receipts is not a big deal, congratulations, go on with your business.
Restricted products can even be unlocked with a  white paper, believe me, or when you are an old account more and more products will be unlocked, without you having to send invoices. 

Selling books might be a risky business, but many people do the same as you do, the only way in which your books might be destroyed is if you sell some and some costumer complains that it is not original, “authenticity complains” so you have to prove that you product is original with invoices that you don’t have, if that happens then Amazon will then take your products to the trash because they don’t want anything to do with counterfeit.

Anyways is not a big deal, 
If I were you, I will not listen to those comments and first send some of those books to see how it goes, not many, you are just learning, so learning costs money and risks. 

Hope you good luck, the thing that might happen is that you sell those, and you will continue fine.",Glum_Chocolate_6780,"2024-10-17, 14:03, Thursday"
FulfillmentByAmazon,1g5fanq,2,"Thats what I'm thinking about doing. Profit requires some amount of risk in any situation and luckily my investment has been very low so far. Ill try sending in the books and see how it goes. I doubt anyone would try and complain about the authenticity of these books (knock on wood), especially with how low my initial volume of sales will be due to limited inventory.",CodoGama,"2024-10-17, 15:46, Thursday"
FulfillmentByAmazon,1g5fanq,1,"Great! Pd: sorry for my bad English, is not my first language",Glum_Chocolate_6780,"2024-10-17, 19:23, Thursday"
FulfillmentByAmazon,1g9em4v,5,"Mattel, Hasbro & Funko stock for sale - great profit : I run an 8-figure Amazon EU business, and have run into an issue with our Amazon US account, where these brands have suddenly become hard gated for us, resulting in stranded inventory.

Are you ungated? if so, then I have some very profitable and good selling products for you. 

Please only serious sellers. 

Let me know if you are interested.",stonksmoi,"2024-10-22, 06:10, Tuesday"
FulfillmentByAmazon,1g9em4v,1,"#####[Join Our Discord Server!](https://discord.gg/VcRZTsS)

We created a Discord server for our community and would like to invite all of you to join! You'll be able to discuss FBA with users around the world and discuss events in real time!

There are separate channels for many FBA topics which you can opt in and out of, including;  
PPC, Listing Optimization, Logistics, Jobs, Advanced FBA, Top Secret/Insider Info, Off-Topic


*I am a bot, and this action was performed automatically. Please [contact the moderators of this subreddit](/message/compose/?to=/r/FulfillmentByAmazon) if you have any questions or concerns.*",AutoModerator,"2024-10-22, 06:10, Tuesday"
FulfillmentByAmazon,1g9em4v,2,I am in the same boat as you are right now. I am open to list Marvel but Amazon is making it so hard for us to ungate Tamashii Nations and Star wars. Though I have invoices from authentic distributors. I have a comparably low quantity but still all are stranded in the warehouse as of now. Why is Amazon making it so difficult to ungate these brands even if you show them the authentic distributors invoices. Any insights?,Burhan-afzal07,"2024-10-22, 10:41, Tuesday"
FulfillmentByAmazon,1g9em4v,3,"I don’t think we have the same issue. These brands are HARD GATED for us, so we can’t even apply. There is no way to fix it besides brand registry role.",stonksmoi,"2024-10-22, 10:57, Tuesday"
FulfillmentByAmazon,1g9em4v,1,Seems like almost all Bandai items are now hard gated. This could be for the entire Q4. I was not aware that people who have sold these goods were possibly having issues like you.,robertw477,"2024-10-22, 10:51, Tuesday"
FulfillmentByAmazon,1g9em4v,1,"Pretty strange from Amazon, we sold an item of Bandai spirit and now they're hard gated.",Burhan-afzal07,"2024-10-22, 11:14, Tuesday"
FulfillmentByAmazon,1g9em4v,1,I wonder if this is the random yearly Christmas lockdown,Tonka858,"2024-10-23, 10:55, Wednesday"
FulfillmentByAmazon,1g9em4v,1,Hi do reach out to me.,Early_Cherry8043,"2024-10-22, 07:17, Tuesday"
FulfillmentByAmazon,1g9em4v,1,Pmed,maxz9394,"2024-10-22, 08:08, Tuesday"
FulfillmentByAmazon,1g8beox,5,"Amazon Business Prime Card (Amex) for Amazon PPC ads?: Amex says their Amazon Business Prime Card includes 5% cash back for the first $120,000 in purchases each calendar year at designated Amazon properties, including ""the website accessible at Amazon.com."" 

Seller Central is accessible at Amazon.com: https://sellercentral.amazon.com

**Do Amazon PPC ads purchased through Seller Central count for the 5% cash back?**

>**Card Offer:** https://www.americanexpress.com/us/credit-cards/business/business-credit-cards/amazon-business-prime-card/
>
> **Amex card terms:** https://www.americanexpress.com/us/credit-cards/card-application/apply/partner/print/business-card/microsite/amz/amazon-prime-business-credit-card/ep-57460
>
> **Amex Amazon Rewards Program Agreement:** https://www.americanexpress.com/content/dam/amex/us/rewards/amazon-rewards/program-agreement.pdf

Old thread: https://www.reddit.com/r/FulfillmentByAmazon/comments/7op5wo/5_cash_back_on_amazon_fees_ppc_with_chase_amazon/

The Amex legal terms do not appear to exclude ad spend, but the Reddit thread from 6 years ago says Amazon Ad Spend was not being awarded 5% cash back at that time.",Tsu-Doh-Nihm,"2024-10-20, 18:53, Sunday"
FulfillmentByAmazon,1g8beox,1,"#####[Join Our Discord Server!](https://discord.gg/VcRZTsS)

We created a Discord server for our community and would like to invite all of you to join! You'll be able to discuss FBA with users around the world and discuss events in real time!

There are separate channels for many FBA topics which you can opt in and out of, including;  
PPC, Listing Optimization, Logistics, Jobs, Advanced FBA, Top Secret/Insider Info, Off-Topic


*I am a bot, and this action was performed automatically. Please [contact the moderators of this subreddit](/message/compose/?to=/r/FulfillmentByAmazon) if you have any questions or concerns.*",AutoModerator,"2024-10-20, 18:54, Sunday"
FulfillmentByAmazon,1g8beox,2,"Get the amex gold business instead. U get 4x on adspend. Watch ur points multiply and travel for free when u have time. 

Points are more valuable than cash back since business points and personal points all go in the same bank. 

Cash back means the value must be kept in your business for business use only.",Clementor,"2024-10-20, 20:09, Sunday"
FulfillmentByAmazon,1g8beox,1,even with the annual fee?,Nodebunny,"2024-10-20, 20:37, Sunday"
FulfillmentByAmazon,1g8beox,1,"Yeah, you just gotta make past $375 worth of points so roughly 37,500 points or about $10,000 of adspend in a year to break even. I spend about $3k a month so its a no brainer. Guess it depends on your situation!",Clementor,"2024-10-20, 20:48, Sunday"
FulfillmentByAmazon,1g8beox,1,If your business can’t afford the AF you don’t have much of a business,xevaviona,"2024-10-20, 23:06, Sunday"
FulfillmentByAmazon,1g8beox,1,Is the points-cashback distinction an IRS thing?,TMWNN,"2024-10-21, 03:40, Monday"
FulfillmentByAmazon,1g8beox,2,"Irs at this time doesnt care about your points. But if your cashing back, it may be forced to go into your business checking (or whichever account you pay your business credit from). Points are in a loophole where u get to convert business value into personal without any taxation. 

Unless you can cash back into a personal account, then thats even bigger of a loop hole. Never tried anything like that before though.",Clementor,"2024-10-21, 03:45, Monday"
FulfillmentByAmazon,1g8beox,2,"The ""cash back"" in cash back cards doesn't always mean actual cash back. 

AMEX cashback is deducted from your statement balance. 

Amazon card cashback is a credit for future spending on Amazon only. 

Chase cash back is actual cash that is deposited via ACH into an account of your choosing. 

Capital One is actual cash back, but you have the request a check in the mail and takes about 2 weeks to arrive.",Xing_the_Rubicon,"2024-10-20, 23:08, Sunday"
FulfillmentByAmazon,1g8beox,2,We use the Chase 1.5% cash back wherever we can and it's super easy with the app to cash out to our non -Chase business checking.,gregariousone,"2024-10-20, 23:32, Sunday"
FulfillmentByAmazon,1g8beox,2,"Chase Premier is 2% cashback, and 2.5% cashback on expenditures over $2,500.",Xing_the_Rubicon,"2024-10-21, 00:03, Monday"
FulfillmentByAmazon,1g8beox,2,"Amex Gold is the standard for most sellers I know - 4x points.

Your bog standard FT Amazon seller with lets say 1M/yr will have 100k of ad spend (10% TACOS, which means 400k points a year, good enough for a fun trip somewhere.",binarysolo,"2024-10-21, 01:20, Monday"
FulfillmentByAmazon,1g8beox,2,i got the card and they did not honor ad spend for the 5%,jjmywayway,"2024-10-21, 15:24, Monday"
EtsySellers,1g6k81b,368,"What to do about a customer demanding a refund for not reading the title or looking at pictures? Please help: Hi! I sell handmade dice and my most popular set is called Scattered Pages: Spilled Ink. It’s highly reviewed, lots of happy people, but I’ve just been sent this message:

“Hi there! I recently purchased your spilled ink dice set, and apparently I really effed up by not paying enough attention. Based on the main, d20 die, I had thought these were script dice. I didn't realize they'd have random ink splotches through them, that just looks like messed up dice. That's not at all a $50 quality dice set, I'd like to return my set for a refund please.”

So… it’s called Spilled Ink, ink splotches are the whole point, I think the item picture is pretty clear and there are even other photos on the listing that show other sides of the D20 that have more ink… What should I do??",NorthVC,"2024-10-18, 11:04, Friday"
EtsySellers,1g6k81b,300,"Definitely not your fault, but also not worth dealing with a bad review over. I would allow a return at their own expense and refund minus original shipping cost. Then you can just resell them and aren't out any money.

Try to phrase the message politely in a way that makes it clear you are kindly making an exception for their mistake, not letting any hint of your justified frustration leak in. For example:

""Hi (customer), Sorry to hear this design isn't the right fit for the aesthetic you're going for. I normally have a no return policy, but can make a one time exception as I understand choosing the perfect set of dice can be tricky! 

After subtracting the cost of shipping & handling including return postage, the refund would be $x. Please confirm you would like to go ahead with this and I'll get a return label generated ASAP.

If you would like to try again with another design in the future, feel free to contact me with questions if you feel the listing images aren't sufficient to get a sense of what the dice will look like in person.

Best, X”",kestrel-tree,"2024-10-18, 12:03, Friday"
EtsySellers,1g6k81b,137,"10/10 script, genuinely thank you. I struggle with text conversations and it can take hours for me to put together a decent email for this sort of thing so this is a huge help, and I agree the right angle to approach from!",NorthVC,"2024-10-18, 12:16, Friday"
EtsySellers,1g6k81b,102,No problem! I got a whole degree in creative writing and English lit and all I use it for is overthinking how to phrase emails 🤣,kestrel-tree,"2024-10-18, 14:46, Friday"
EtsySellers,1g6k81b,14,"In this case, chatgpt can be your best friend! Type in whatever you wanna write and tell it to make it sound more professional and friendly.",tab_tab_tabby,"2024-10-18, 16:55, Friday"
EtsySellers,1g6k81b,1,"I am not sure you can charge the customer for shipping in EU as they have right to return it but they pay for return shipping.
Need to check laws before asking the customer to pay shipping back and forth. As you pay to ship to customer and they pay to ship back. As far as I know. Maybe I am wrong",Imaginary_Scarcity58,"2024-10-19, 07:39, Saturday"
EtsySellers,1g6k81b,170,"the quip about the price and quality instantly pisses me off and makes me a lot less willing to work with the customer

but your goal here is to avoid a bad review that's going to talk about the product quality

so generally in your shoes here I'll reiterate my no returns policy, but say ""as a one time exception I can process a return here if you're willing to pay initial and return shipping.  Initial shipping was $12.99 and I expect return shipping will be similar.  If you'd like to proceed, let me know and I'll generate a label""",TiberiusDrexelus,"2024-10-18, 11:22, Friday"
EtsySellers,1g6k81b,51,"Right? I’m gonna just take that one on the chin lol, people are generally happy with quality. I’m leaning that way as well, the shipping was my biggest hang up to do a return because my margins aren’t exactly stellar, but I didn’t know you could issue partial refunds sans-shipping or generate return labels for customers. I’ll have to look into that! Thanks :)",NorthVC,"2024-10-18, 11:28, Friday"
EtsySellers,1g6k81b,21,"use pirate ship for all labels, set it up today because you lose the ability to integrate with etsy like tomorrow.

trivial to generate any label under the sun with it

and then you'll hit the ""refund"" button on your PC, not the ""cancel"" button, and deduct your shipping costs

be very polite throughout and don't engage with them on the price/ quality shit, as they'll still be able to leave a review",TiberiusDrexelus,"2024-10-18, 11:37, Friday"
EtsySellers,1g6k81b,12,"Just a tip, don’t refund until you have received and inspected the item upon return. Let them know in your initial message that they won’t be refunded until it has arrived back to you.

If you refund now and they don’t send the item back, you’re SOL",jocelynforreal,"2024-10-18, 14:21, Friday"
EtsySellers,1g6k81b,25,"I had this happen a few times and added a step in my listing to confirm that the item I'm selling only fits a certain model of equipment and they have to put ""okay"" in the personalization text entry box to acknowledge this. It's solved the problem.",Liquidretro,"2024-10-18, 12:05, Friday"
EtsySellers,1g6k81b,17,"That’s a dang good idea, it’s in all of my descriptions that they’re handmade and the ink effect will vary, but adding a tick box to make that impossible to miss is something I’ll def consider adding",NorthVC,"2024-10-18, 12:08, Friday"
EtsySellers,1g6k81b,17,"These are cool!

Accept the return and once you’ve received the dice, refund the money.

Returns happen and it isn’t worth a bad review to fight it.  I do not allow returns on custom items, but why not for a popular item you keep in stock?

It’s a pain and a little extra work to process a return, but that’s part of running a business, some customers are more time consuming than others.",Inspected_By1410,"2024-10-18, 12:06, Friday"
EtsySellers,1g6k81b,69,"No advice to give; just wanted to say that as an author and a geek, these are **SO FREAKING COOL**.  
They totally deserve to be on their own little display base on a desk right next to a stack of story bibles and scene cards.  
(And I'm /facepalming over your customer's excuse for his splurge-spending remorse. The listing title and this single photo alone make it crystal clear that they've got splotches of *spilled ink* in them.)",Hoopatang,"2024-10-18, 11:31, Friday"
EtsySellers,1g6k81b,18,"Right?? And the ink spills make them all the more special, that’s truly one of a kind. How are people so… <gestures vaguely> sometimes?",Oohlala80,"2024-10-18, 11:50, Friday"
EtsySellers,1g6k81b,10,"Thank you, I really appreciate that, it’s definitely the vibe I was going for with these and I really do try to make my listings as descriptive and accurate as possible, it’s harsh for something you work so hard on haha",NorthVC,"2024-10-18, 11:48, Friday"
EtsySellers,1g6k81b,5,I don't even play any ttrpgs and I kinda want these because of the pages in them,feisty-spirit-bear,"2024-10-18, 15:06, Friday"
EtsySellers,1g7elw6,221,Just fyi for anyone that uses pirate ship for Etsy orders:,sunshine_babe,"2024-10-19, 13:55, Saturday"
EtsySellers,1g7elw6,1,This is going to be our go to post for discussion of this change.,lostterrace,"2024-10-19, 14:27, Saturday"
EtsySellers,1g7elw6,155,"I just got the same email and I’m so bummed about this. I love PirateShip (often their international rates - especially for expedited services - are significantly cheaper than anywhere else and their customer service is excellent). I’ll continue to use them, even if I have to type every line myself, because f**k this race to the bottom that Etsy seems intent upon now.",Fair_Leadership76,"2024-10-19, 14:11, Saturday"
EtsySellers,1g7elw6,11,I will be doing the same thing!,Witty-Ad805,"2024-10-19, 16:02, Saturday"
EtsySellers,1g7elw6,11,The nice thing about pirate ship is if you put the address in it'll auto populate almost the entire rest of the address,ONION_CAKES,"2024-10-19, 22:20, Saturday"
EtsySellers,1g7elw6,8,Yes. It’s more than that though. Without the synching we’ll also have to manually cut and paste tracking into Etsy to mark the sale as shipped properly (and to maintain the seller protection). It’s not much for one order but it adds up. It’s just another weight on the side of the scale marked “Etsy really doesn’t give a shit about its sellers”,Fair_Leadership76,"2024-10-19, 23:14, Saturday"
EtsySellers,1g7elw6,185,Even Pirateship can't talk to a human at Etsy. Classic LOL,Sunna420,"2024-10-19, 14:02, Saturday"
EtsySellers,1g7elw6,28,I’ve been looking for someone to point this out. How unprofessional! Stuff like that says so much between the lines…,_someone_special_,"2024-10-19, 15:25, Saturday"
EtsySellers,1g7elw6,50,"Oh cool. I can get a label third party in Canada for $12, but the same label Etsy charges $20+ for.

Fuck Etsy.",friblehurn,"2024-10-19, 14:31, Saturday"
EtsySellers,1g7elw6,2,What do you use to ship? I know we don't have pirateship up here...,ohyeaitspizzatime,"2024-10-19, 15:13, Saturday"
EtsySellers,1g7elw6,3,Chitchats,kingbain,"2024-10-19, 17:33, Saturday"
EtsySellers,1g7elw6,1,Also wondering,-Jae-_,"2024-10-19, 16:16, Saturday"
EtsySellers,1g7elw6,42,I’ll just keep typing the tracking number into Etsy manually then,razzmataz_,"2024-10-19, 14:20, Saturday"
EtsySellers,1g7elw6,7,Same.,Excellent-Anxiety404,"2024-10-19, 14:43, Saturday"
EtsySellers,1g7elw6,5,Do it,AIcohol,"2024-10-19, 14:27, Saturday"
EtsySellers,1g8ojga,169,"I'm gonna take a few minutes to apologize for my ignorance on Ai generation art being sold on Etsy...: No, seriously. To all of the digital artists selling their art, I'm sorry that I defended AI users, even for a brief moment. I'm constantly being smacked in the face with terrible canva mash ups and Ai generated art because of these digital products gurus. I didn't think that it was bad but its terrible. It's all over etsy and im seeing so many Tiktok LIVES about step by step prompt details through Chat GPT, and teachings of how to sell them through POD.

I was looking for some artwork to hang in my bedroom (jungle theme) and I'm seeing tigers with confusing strips, crossing eyes, and extra toes... And that ""Ai glow"" is so off putting...So if you know any digital artist on etsy selling their work please drop it below. 

From one etsy seller to all, Again, I am sorry.",KeepinItGorgeous,"2024-10-21, 08:31, Monday"
EtsySellers,1g8ojga,95,"I am an artist on Etsy 😓 my prints and stickers are made in-house, and I've never used POD services or AI. The first few years of selling were actually amazing and my sales were consistent. But this year, even with all the promotional work I put in elsewhere, it dropped drastically off a cliff. The site is completely flooded with soulless AI work with prices I could never compete with and it feels so defeating. I've honestly been considering throwing in the towel on it all, but then I know there will be one less human artist on Etsy and that though depresses me too. I had hoped that Etsy would have a bit more integrity when it came to what they allow, but here we are. ",Spooky_Gecko,"2024-10-21, 08:57, Monday"
EtsySellers,1g8ojga,30,I'm seriously sorry. Please dont give up. We need more artists to push their work. There has to be a way to challenge this. :/,KeepinItGorgeous,"2024-10-21, 09:36, Monday"
EtsySellers,1g8ojga,11,"Thank you 🧡 even though it's tempting, this won't be the thing that makes me stop doing what I love. think the only way we can challenge it is to stay put and push back. Hopefully someday soon more people will be  like you and will have that craving for human art again! ",Spooky_Gecko,"2024-10-21, 09:53, Monday"
EtsySellers,1g8ojga,11,"Yeah, I get you. I've decided to throw the towel in about a month or so. It's really clear that my shop is being pushed out by AI art with declining views etc. (I do commissions, so there are a lot of prompters), and I'm finally done. The funny thing is, I don't really feel sad—just tired (I tried advertisment, promotions, chasing tags, key words and stuff for a long time now). Maybe in the future, the whole AI thing on Etsy will change i dunno, I've lost faith in this website for forgetting that it was supposed to be a marketplace for handmade goods hah.",Ornery_Cut_2093,"2024-10-21, 15:58, Monday"
EtsySellers,1g8ojga,-16,"Simply not true. If the AI and art are that terrible, it won't sell. And it falls from the ranks pretty fast. If you're getting out done by AI, then you're being beaten by crap art... so you are all saying.",IronbarkUrbanOasis,"2024-10-21, 16:30, Monday"
