subreddit,post_id,upvote_score,submission_content,author,created_utc
FulfillmentByAmazon,1g861tk,19,"2 days left to reimburse for 18 months lost and damaged inventory: Did you already reimburse your money from Amazon? If not, do it by 23rd October as the policy is being changed after then. Do a self audit for how much inventory amazon lost and then take an action. Writing the detail procedure for this.

1. Download your Inventory detail ledger
2. Filter the reason code D,E,M,Q
3. Check the unreconciled column for finding the number of inventory still not reconciled. If the number is high, indicate initially you'll have a large amount to get reimbursed from Amazon.
4. Need to go for final step by creating cases using the reference number of the missing events.

Note: Don't submit case including more than 5 reference ids, it may take much time.",XFinsights,"2024-10-20, 14:54, Sunday"
FulfillmentByAmazon,1g861tk,1,"#####[Join Our Discord Server!](https://discord.gg/VcRZTsS)

We created a Discord server for our community and would like to invite all of you to join! You'll be able to discuss FBA with users around the world and discuss events in real time!

There are separate channels for many FBA topics which you can opt in and out of, including;  
PPC, Listing Optimization, Logistics, Jobs, Advanced FBA, Top Secret/Insider Info, Off-Topic


*I am a bot, and this action was performed automatically. Please [contact the moderators of this subreddit](/message/compose/?to=/r/FulfillmentByAmazon) if you have any questions or concerns.*",AutoModerator,"2024-10-20, 14:54, Sunday"
FulfillmentByAmazon,1g861tk,3,"You can put the FNSKU of the product that is unreconciled in the bottom field of this page to more or less automate the case creation:

[https://sellercentral.amazon.com/help/hub/reference/GGEV4254LJJ9BAEG](https://sellercentral.amazon.com/help/hub/reference/GGEV4254LJJ9BAEG)",Lance_711,"2024-10-20, 23:14, Sunday"
FulfillmentByAmazon,1g861tk,1,Do I filter the reason code in excel after I download the document? Not sure which categories I should look at,Rcnall,"2024-10-20, 15:26, Sunday"
FulfillmentByAmazon,1g861tk,1,Yeah. Filter the reason code in excel. You just download the detail ledger and filter the reason colmun,XFinsights,"2024-10-20, 15:28, Sunday"
FulfillmentByAmazon,1g861tk,1,Thank you. Can you post an example of what your case message looks like?,YagerD,"2024-10-20, 18:14, Sunday"
FulfillmentByAmazon,1g861tk,1,"I usually post “For shipment ID ______ we shipped 100 units of _____ and you’re showing you received 70 units. Please see attached screenshots including the purchase invoice from the manufacturer, a screenshot of us receiving the 100 units in our system, a screenshot of the FBA workflow for the 100 units, a screen shot of the tracking (or BOL) showing the 100 delivered to your FC”

some version of that",ZombieQueen666,"2024-10-22, 14:05, Tuesday"
FulfillmentByAmazon,1g861tk,1,"Isn’t there a short cut to manually submit a case in help section for every FNSKU?  That’s what I did and if there was a problem, it would locate and credit me",honeybee8388,"2024-10-21, 03:09, Monday"
FulfillmentByAmazon,1g861tk,1,[https://sellercentral.amazon.com/help/hub/reference/G200213130](https://sellercentral.amazon.com/help/hub/reference/G200213130) use this link for manual entry. Don't add more than 5 reference numbers in each case.,XFinsights,"2024-10-21, 03:40, Monday"
FulfillmentByAmazon,1g5n186,10,"Will amazon do anything to stop nearly all Vine reviews being 100% AI slop?: Vine used to be a handy resource for getting detail and well written reviews, now pretty much every review is AI written.

I've been using and reading AI content for a while now and can spot them a mile off.

Would love to do a deep dive into review words and phrases since AI became popular, so many words GPT over uses- vibrant, majestic, holistic etc",Jeff-Stelling,"2024-10-17, 05:38, Thursday"
FulfillmentByAmazon,1g5n186,1,"#####[Join Our Discord Server!](https://discord.gg/VcRZTsS)

We created a Discord server for our community and would like to invite all of you to join! You'll be able to discuss FBA with users around the world and discuss events in real time!

There are separate channels for many FBA topics which you can opt in and out of, including;  
PPC, Listing Optimization, Logistics, Jobs, Advanced FBA, Top Secret/Insider Info, Off-Topic


*I am a bot, and this action was performed automatically. Please [contact the moderators of this subreddit](/message/compose/?to=/r/FulfillmentByAmazon) if you have any questions or concerns.*",AutoModerator,"2024-10-17, 05:38, Thursday"
FulfillmentByAmazon,1g5n186,11,And sometimes they just give you less star even saying they liked the product,TradeSpecialist7972,"2024-10-17, 06:11, Thursday"
FulfillmentByAmazon,1g5n186,11,"Yeah got one star less because they say the product was only 15ml, which was stated on the box. Donkey",Traffalgar,"2024-10-17, 07:26, Thursday"
FulfillmentByAmazon,1g5n186,5,We got a 1 star that praised the product haha frustrating..,MidwestSeller,"2024-10-17, 11:00, Thursday"
FulfillmentByAmazon,1g5n186,3,Very annoying,TradeSpecialist7972,"2024-10-17, 11:30, Thursday"
FulfillmentByAmazon,1g5n186,5,"Sure, here’s a possible Reddit reply:

You’re absolutely spot on. As someone who has been following the evolution of both AI content and the Vine program, the shift is pretty obvious. The AI-written reviews often follow certain patterns—overly polished sentences, generic adjectives (like “exceptional,” “seamless,” “immersive”), and zero nuance about product flaws that real users tend to mention.

Amazon should care about this since fake or low-quality reviews erode consumer trust, but it’s tough to say how far they’ll go to fix it. Right now, the incentive is heavily tilted towards volume and maintaining engagement with Vine reviewers, not necessarily ensuring authenticity. Plus, with AI tools becoming accessible to anyone, many reviewers are just cranking out these automated reviews for the freebies without much thought.

I’d love to see Amazon integrate stricter moderation—maybe using behavioral signals to catch reviews that look too perfect or are generated too quickly. Or, they could flag users for review patterns like repetitive language or lack of specific product insights. That said, I wouldn’t hold my breath.

Ultimately, the onus is probably going to fall on us as shoppers to filter through the noise and lean on community-driven feedback or niche review sites.

PS: You nailed it with ""vibrant,"" ""holistic,"" and ""majestic."" If I see “holistic experience” in a mousepad review one more time... 😩

--------------------------------------------------------------

But why bother when you can generate trash like this in 5 seconds?  If Vine reviews were forced to post pictures or videos then I'd be OK with the crap the reviews have become but yeah, it's making new listings look fake.",GeneralCheese,"2024-10-17, 11:41, Thursday"
FulfillmentByAmazon,1g5n186,3,"Yeah Vine has definitely gotten worse as of late. We put a product into vine. This product was marketed towards mothers. It’s got the name “Mother” in the Name even to make this clear. We got a 2* vine review that read “I do not understand why this company does not have a similar product aimed at fathers, very disappointing”. 1, we do have one. 2, you’re reviewing a fucking mother product, how is that relevant.

Seller support said the review was vine",Relative_Abroad8773,"2024-10-18, 02:53, Friday"
FulfillmentByAmazon,1g5n186,2,LMAO.,eret2k,"2024-10-18, 17:11, Friday"
FulfillmentByAmazon,1g5n186,1,"Yeah, I’ve noticed the same thing with Vine reviews. They used to be super helpful, but now so many of them just sound like generic AI-generated fluff. I swear I can spot AI reviews instantly always the same buzzwords like *vibrant*, *majestic*, or *holistic*

Amazon really needs to step up their game. Maybe they could implement something to verify if a human actually wrote the review? Or at least tighten up their guidelines to make the reviews more detailed and personal. It’s annoying because you just want honest feedback, not some AI regurgitating marketing terms.

Would be cool to see a deep dive into the overused words since AI took off. Feels like you could almost create a bingo card with the ones that show up all the time.",KhalidPhoenix,"2024-10-17, 11:49, Thursday"
FulfillmentByAmazon,1g5yqoz,9,"Is it against Amazon's TOS to provide a product insert with company contact information and/or to request a review?: I'm thinking of making a product insert that includes 2 QR codes.  One to an e-mail to our support e-mail and another to request a 5 star review on Amazon.  Is this against Amazon's TOS in any way?  If so, is there any way to do something similar?  

If anyone has any information on this at all it would be very helpful.  Thank you!",Orion_Oregon,"2024-10-17, 15:09, Thursday"
FulfillmentByAmazon,1g5yqoz,1,"#####[Join Our Discord Server!](https://discord.gg/VcRZTsS)

We created a Discord server for our community and would like to invite all of you to join! You'll be able to discuss FBA with users around the world and discuss events in real time!

There are separate channels for many FBA topics which you can opt in and out of, including;  
PPC, Listing Optimization, Logistics, Jobs, Advanced FBA, Top Secret/Insider Info, Off-Topic


*I am a bot, and this action was performed automatically. Please [contact the moderators of this subreddit](/message/compose/?to=/r/FulfillmentByAmazon) if you have any questions or concerns.*",AutoModerator,"2024-10-17, 15:09, Thursday"
FulfillmentByAmazon,1g5yqoz,12,You can’t request a 5 star review. You can ask for a review but you can’t specify the quality nor can you offer anything in exchange for a review.,ChiFitGuy,"2024-10-17, 15:17, Thursday"
FulfillmentByAmazon,1g5yqoz,4,"This is correct. 

Also you cannot attempt to divert a negative review so always tread carefully with language like “if you have a problem contact us” as that can be seen as causing a diversion.",herbdogu,"2024-10-17, 15:38, Thursday"
FulfillmentByAmazon,1g5yqoz,3,https://sellercentral.amazon.com/seller-forums/discussions/t/6283f003b080fcf126e8517bb0031001,jrossetti,"2024-10-17, 21:08, Thursday"
FulfillmentByAmazon,1g5yqoz,2,You can't request. You can definitely include 5 consecutive stars as part of your design though,carolinax,"2024-10-17, 17:05, Thursday"
FulfillmentByAmazon,1g5yqoz,6,"Including company contact info could be troublesome since Amazon wants to keep communication within their platform. We do include inserts asking for reviews, but not 5 star reviews and we don't include any company contact info.",Lucita_Bonita,"2024-10-17, 15:59, Thursday"
FulfillmentByAmazon,1g5yqoz,2,Accounts are being suspended left right and center for this.,TheManWith2Poobrains,"2024-10-17, 20:33, Thursday"
FulfillmentByAmazon,1g5yqoz,6,You are not allowed to add inserts . This is against amazons TOS. Also requesting a 5 star review is also against it.,_-undercoverlover-_,"2024-10-17, 17:15, Thursday"
FulfillmentByAmazon,1g5yqoz,2,Indeed. Amazon is coming down really hard now.,TheManWith2Poobrains,"2024-10-17, 20:34, Thursday"
FulfillmentByAmazon,1g5yqoz,2,"Are you allowed to put something on the instructions like ""For questions, comments or concerns, please e-mail Support@"" or something similar to this as long as it doesn't mention reviews?  Mainly because the support e-mail would be communication outside of Amazon seems like it's possibly a violation.",Orion_Oregon,"2024-10-18, 12:01, Friday"
FulfillmentByAmazon,1g5yqoz,3,"You are incorrect. Inserts that encourage customers to visit an external website or use an offer that’s not available on Amazon are against their terms of service. However, inserts that enhance customer experience without diverting sales are allowed.",MeeshTheDog,"2024-10-17, 17:31, Thursday"
FulfillmentByAmazon,1g5yqoz,7,"This is what Amazon says specifically.
""
""Customer reviews help customers make informed purchase decisions and are a great source of suggestions about how to improve your products. Authentic customer reviews help new customers find and evaluate your products before purchasing.

We want to remind you that Amazon policies prohibit box inserts and product packaging that direct customers to write a positive review, even if no incentive is offered for the review. Similarly, directing customers to contact you instead of leaving a negative review on Amazon is also prohibited. Please ensure your product packaging and box inserts are compliant with these policies before shipping your products to a fulfillment center or to customers. If you have products that are already in fulfillment centers and are in violation of Amazon's policies, you can create a removal order to proactively remove your inventory.

Review our customer review policies on Seller Central""


https://sellercentral.amazon.com/seller-forums/discussions/t/6283f003b080fcf126e8517bb0031001",jrossetti,"2024-10-17, 21:08, Thursday"
FulfillmentByAmazon,1g5yqoz,1,"What if the insert has instructions on it mainly, but it also has something like this: ""For questions, comments or concerns, please e-mail Support@"" 

Would that be a violation?",Orion_Oregon,"2024-10-18, 12:02, Friday"
FulfillmentByAmazon,1g5yqoz,2,"""Customer reviews help customers make informed purchase decisions and are a great source of suggestions about how to improve your products. Authentic customer reviews help new customers find and evaluate your products before purchasing.

We want to remind you that Amazon policies prohibit box inserts and product packaging that direct customers to write a positive review, even if no incentive is offered for the review. Similarly, directing customers to contact you instead of leaving a negative review on Amazon is also prohibited. Please ensure your product packaging and box inserts are compliant with these policies before shipping your products to a fulfillment center or to customers. If you have products that are already in fulfillment centers and are in violation of Amazon's policies, you can create a removal order to proactively remove your inventory.""



https://sellercentral.amazon.com/seller-forums/discussions/t/6283f003b080fcf126e8517bb0031001",jrossetti,"2024-10-17, 21:09, Thursday"
FulfillmentByAmazon,1g7yhky,6,"Should I do dayparting for PPC?: I'm a new seller and noticing that all my PPC conversions are coming in between a 6ish hour window. Would it be best to use a start and end time rule to my campaigns? Or is this the norm because most people tend to buy things in the evening? For people who do dayparting, how much bid adjustment is usually recommended?

  
Thanks!",PomegranateAble222,"2024-10-20, 09:17, Sunday"
FulfillmentByAmazon,1g7yhky,1,"#####[Join Our Discord Server!](https://discord.gg/VcRZTsS)

We created a Discord server for our community and would like to invite all of you to join! You'll be able to discuss FBA with users around the world and discuss events in real time!

There are separate channels for many FBA topics which you can opt in and out of, including;  
PPC, Listing Optimization, Logistics, Jobs, Advanced FBA, Top Secret/Insider Info, Off-Topic


*I am a bot, and this action was performed automatically. Please [contact the moderators of this subreddit](/message/compose/?to=/r/FulfillmentByAmazon) if you have any questions or concerns.*",AutoModerator,"2024-10-20, 09:17, Sunday"
FulfillmentByAmazon,1g7yhky,5,"Last November Amazon added the ability to download an hourly campaign report. Unfortunately, it's only available through the GUI, can only be downloaded in 14-day chunks, and only goes back 30 days. Start collecting this data now. Depending on what your products/niches are will impact when the best day/time to advertise is. Some products sell better at midnight on weekends while others sell best mid-day on weekdays. Use the report data to create scheduled rules that increase your bids during specific days of the week and times of the day that result in better ACOS/ROAS.

Here's a chart showing my data from 1 niche of products for a 4-month period. [https://i.imgur.com/rdUsCoi.png](https://i.imgur.com/rdUsCoi.png) Here's the same chart with 4 months of data after I implemented scheduled rules. [https://i.imgur.com/DsqBhKz.png](https://i.imgur.com/DsqBhKz.png)

Each of my campaigns were individually customized based on this report data. Considering that I'm always tweaking my campaigns in other ways too it's difficult to perfectly compare. My afternoons received the best improvements which is where I reduced my spend most. I also reduced my overnight bids but the ACOS didn't change much. I'll need to dig deeper and compare CPC for those time periods. It's also worth noting that my worst hours for ACOS are my least amount of spend as well, at only 7% of the days spend.

There are endless ways to analyze and tweak your campaigns. I'll revisit scheduled rules again once I have the same month against month comparison available.",LostMyMilk,"2024-10-20, 12:14, Sunday"
FulfillmentByAmazon,1g7yhky,2,Yes. Anyone that doesn't day part is putting money into Bezos girlfriend new dog.,syddakid32,"2024-10-20, 10:42, Sunday"
FulfillmentByAmazon,1g7yhky,1,haha got it. what kind of bid adjustments do you use if i may ask?,PomegranateAble222,"2024-10-20, 11:00, Sunday"
FulfillmentByAmazon,1g7yhky,3,"Its a very very complicated process. I've uploaded close to 25k ads so far. You have to weed out the bad and keep the good.


Use only fixed bids. Never allow any company to use their automated tools to increase your bids. Because they will increase your bids and your competition bids to go against each other.",syddakid32,"2024-10-20, 11:05, Sunday"
FulfillmentByAmazon,1g7yhky,1,"Hey there,

Great question! Dayparting can definitely be an effective strategy, especially if you’re noticing a clear trend in when your conversions are happening. Since you're a new seller, it’s good that you’re already tracking this data—it gives you a great foundation for making informed decisions.

Here are a few things to consider:

1. **Test Dayparting Gradually**: If most of your conversions are happening within a 6-hour window, it might be worth testing dayparting by setting up a start and end time for your campaigns during those hours. Just make sure to monitor performance closely after you implement the change, as it may affect your overall impressions and visibility.
2. **Buying Patterns**: It’s normal for conversions to spike in the evening because that’s when many shoppers are browsing, but this can vary by product category. Keep in mind that as your product gains more traction, buying behavior could shift over time, so it’s important to reassess periodically.
3. **Bid Adjustments**: For bid adjustments, it’s usually recommended to start with a moderate increase or decrease (like 10-20%) based on the times you’re seeing higher or lower performance. The goal is to maximize your ad spend during peak hours without cutting off potential sales during off-peak times entirely.
4. **Run an A/B Test**: You could also consider running an A/B test by comparing the performance of your PPC campaigns with and without dayparting. This way, you’ll have more concrete data to back up your decision.",ApplicationCalm7848,"2024-10-21, 04:04, Monday"
FulfillmentByAmazon,1g5uf7v,8,"Balancing Amazon and E-commerce Platforms: Hi everyone!

I’ve been selling on Amazon for 5 years and have finally reached stable revenue. Now, I’m starting to consider whether it’s time to invest in my own e-commerce platform.

For those of you selling on both Amazon and your own website, how do you manage to balance the two? Do you have any recommendations or insights to share?",Warm-Spread-9861,"2024-10-17, 12:05, Thursday"
FulfillmentByAmazon,1g5uf7v,1,"#####[Join Our Discord Server!](https://discord.gg/VcRZTsS)

We created a Discord server for our community and would like to invite all of you to join! You'll be able to discuss FBA with users around the world and discuss events in real time!

There are separate channels for many FBA topics which you can opt in and out of, including;  
PPC, Listing Optimization, Logistics, Jobs, Advanced FBA, Top Secret/Insider Info, Off-Topic


*I am a bot, and this action was performed automatically. Please [contact the moderators of this subreddit](/message/compose/?to=/r/FulfillmentByAmazon) if you have any questions or concerns.*",AutoModerator,"2024-10-17, 12:05, Thursday"
FulfillmentByAmazon,1g5uf7v,1,Are you wanting to run them side by side? My biggest tip is price parity across your items and keep the content slightly different for SEO.,_-undercoverlover-_,"2024-10-18, 08:46, Friday"
FulfillmentByAmazon,1g5uf7v,0,"I want to share my insights from my journey with online stores. Initially, I built my store on Magento. It was a complex system requiring specialized servers, costing me around $500 a month just for hosting. Edits to the website were cumbersome, and hiring developers was prohibitively expensive.

I then shifted to WooCommerce/WordPress. While it also necessitates servers, you can't rely on public servers; you need a VPS for reliable performance. Plus, you’ll need a merchant account for checkout, which adds even more development costs. If you lack development experience, this will quickly become a financial burden. Stay away from platforms like Wix and Squarespace. They may work for small sites, but they buckle under heavy traffic. The same goes for WooCommerce; a surge in traffic demands robust servers capable of scaling, which translates to higher expenses.

My first experience with Shopify was a migration from Magento back in 2012. I imported a little over 400,000 SKUs along with their content. To put in perspective, my Magento site was costing me around $1,500 a month just for server fees due to the volume of content and traffic. After migrating to Shopify, I was shocked by the speed of my new site. I called Shopify to confirm there hadn’t been a mistake, as my costs were just a few dollars a month. They explained that no matter if you have five products or 5,000, they allocate the same server resources to all clients.

I encountered issues during my initial setup, but Shopify's support resolved everything efficiently with one phone call. This experience solidified my belief that Shopify is a highly reliable website builder, standing strong against big players like Magento—all at an unbelievably low cost.

That said, be aware that Shopify does have substantial processing fees if you use Shopify Payments( I believe it's closer to 3 or 4%). In contrast, with WooCommerce or Magento, you can choose your own payment processor, paying only the interchange rate plus $0.10 (in most cases). While Shopify provides better user experience out of the box, custom builds may require hiring a developer, which can easily run into six figures.

What I appreciate about Shopify is its functionality as a CRM. It grants me detailed insights into customer data and allows for seamless integration of marketing tools. However, I have significant concerns regarding the app market. Many apps appear tempting, but it’s crucial to know who’s behind them and where your information is going. I've experienced data leaks due to backdoor access from app developers, so be diligent—avoid adding apps with only a handful of reviews and mediocre ratings.

Today, I’m recognized as a Shopify Partner. One of the major advantages of this role is the ability to set up stores in development mode, meaning you only pay once your store goes live, in the meantime you can build out your store as you wish. If you’re ready to explore the Shopify platform, I can provide you with a development store to build your site, and you can launch it whenever you choose.",Vincenzooos,"2024-10-17, 20:31, Thursday"
FulfillmentByAmazon,1g5uf7v,0,"I'm about to go on a similar journey myself. I have been selling on amazon since 2014. 

I'm branching out on my own shopify site in 2025. I'm B2C on amazon and sell below $10 on most goods.  My mode selling price is less than $10 per good sold and my average FBA fee is more than $3.

I've considered woo commerce, but selected shopify in interest of having details taken care of for me by the shopify platform (hosting, security, compliance). Additionally shopify is easy to work (easy to edit for a non developer like me). More importantly it has a great converting checkout. What i mean by a great converting checkout is that consumers reportedly are really comfortable, familiar, and willing to use the shopify checkout as opposed to all the other options available. 

For shipping, this is a big one. My goods take up a lot of space and are low value, so I had to get this right. I got myself  UPS business shipping account and am able to ship more cheaply than through a shipping service. This is really surprising to me and my point of contact at UPS. But Im at the extreme end of shipping dimensions. a 10""x10""x10"" package for me will way less than 5 pounds.

Here is my value proposition on Shopify. I can offer B2B competitive B2B pricing on my goods. While my goods are cheap to make and sell, they cost a lot to ship. The reason I am branching out B2B now (well in 2025) is because I found two solid suppliers that are able to produce my goods in really low moq for a reasonable price, and at expected standard moq but at a phenomenal price. So I will offer my goods and services and emphasize customization as a possiblity. 

  
Please feel free to ask me questions. I havent truly started this journey yet, and questions and comments may bring up an important point that I've yet to consider.",80sHair,"2024-10-17, 18:29, Thursday"
